[
  {
    "entry_id": "semantic-rule_RULE-001-ai-native-format-1779813431455",
    "task_id": null,
    "step_number": null,
    "timestamp": "2026-05-26T16:37:11.454Z",
    "track_type": "semantic",
    "content": {
      "fact": "AI-Native формат: JSON primary, markdown derivative\nВсе артефакты loom хранятся в JSON как source of truth. Markdown-производные генерируются из JSON и не должны редактироваться вручную. Машинные маркеры (INVARIANT:, PRE:, POST:, CONTRACT:, BLOCK:, SCOPE:, EVIDENCE:) — на английском.",
      "category": "rule",
      "confidence": 1,
      "domain": "documentation"
    },
    "relevance_score": 1,
    "source_ref": "rule:RULE-001-ai-native-format",
    "tags": [
      "rule",
      "documentation"
    ],
    "created_at": "2026-05-26T16:37:11.454Z",
    "updated_at": "2026-05-26T16:37:11.454Z",
    "expires_at": null,
    "access_count": 0,
    "last_accessed_at": "2026-05-26T16:37:11.454Z"
  },
  {
    "entry_id": "semantic-rule_RULE-002-localization-1779813431455",
    "task_id": null,
    "step_number": null,
    "timestamp": "2026-05-26T16:37:11.454Z",
    "track_type": "semantic",
    "content": {
      "fact": "Локализация: русский для оператора, английский для машин\nSystem prompts, JSON schemas, code comments, machine-маркеры — только на английском. UI, команды, уведомления оператору, markdown-артефакты — на русском. Команды, пути, ID — exempt. Все markdown-артефакты проходят localization guard перед finalize.",
      "category": "rule",
      "confidence": 1,
      "domain": "localization"
    },
    "relevance_score": 1,
    "source_ref": "rule:RULE-002-localization",
    "tags": [
      "rule",
      "localization"
    ],
    "created_at": "2026-05-26T16:37:11.454Z",
    "updated_at": "2026-05-26T16:37:11.454Z",
    "expires_at": null,
    "access_count": 0,
    "last_accessed_at": "2026-05-26T16:37:11.454Z"
  },
  {
    "entry_id": "semantic-rule_RULE-003-decision-making-1779813431455",
    "task_id": null,
    "step_number": null,
    "timestamp": "2026-05-26T16:37:11.454Z",
    "track_type": "semantic",
    "content": {
      "fact": "Decision Making: STOP при неоднозначности, варианты 1/2/3 или А/Б/В\nАгент принимает решения автономно, если контекст однозначен. При неоднозначности — STOP, явный вопрос оператору с вариантами (только цифры 1/2/3 или кириллица А/Б/В). Никаких 'предположим по умолчанию'.",
      "category": "rule",
      "confidence": 1,
      "domain": "other"
    },
    "relevance_score": 1,
    "source_ref": "rule:RULE-003-decision-making",
    "tags": [
      "rule",
      "other"
    ],
    "created_at": "2026-05-26T16:37:11.454Z",
    "updated_at": "2026-05-26T16:37:11.454Z",
    "expires_at": null,
    "access_count": 0,
    "last_accessed_at": "2026-05-26T16:37:11.454Z"
  },
  {
    "entry_id": "semantic-rule_RULE-004-knowledge-accumulation-1779813431455",
    "task_id": null,
    "step_number": null,
    "timestamp": "2026-05-26T16:37:11.454Z",
    "track_type": "semantic",
    "content": {
      "fact": "Накопление знаний: каждая задача оставляет след\nКаждая задача — атом знаний. После завершения задачи все артефакты сохраняются в knowledge/tasks/<TASK-ID>/. Project-level память накапливается в knowledge/project/. Cross-task inheritance: агент обязан читать закрытые задачи при работе над новыми.",
      "category": "rule",
      "confidence": 1,
      "domain": "documentation"
    },
    "relevance_score": 1,
    "source_ref": "rule:RULE-004-knowledge-accumulation",
    "tags": [
      "rule",
      "documentation"
    ],
    "created_at": "2026-05-26T16:37:11.454Z",
    "updated_at": "2026-05-26T16:37:11.454Z",
    "expires_at": null,
    "access_count": 0,
    "last_accessed_at": "2026-05-26T16:37:11.454Z"
  },
  {
    "entry_id": "semantic-rule_RULE-005-git-flow-1779813431455",
    "task_id": null,
    "step_number": null,
    "timestamp": "2026-05-26T16:37:11.454Z",
    "track_type": "semantic",
    "content": {
      "fact": "Git Flow: task-scoped commits, staged список, review перед merge\nWorker делает task-scoped commits по staged-списку (files-to-commit.json). Reviewer анализирует git diff + файлы. Executor: approve → следующий шаг, reject → доработка (макс 10 iter). Human-in-the-loop только при reject+max_iter, timeout, ambiguity. После approve — merge в base-ветку.",
      "category": "rule",
      "confidence": 1,
      "domain": "git"
    },
    "relevance_score": 1,
    "source_ref": "rule:RULE-005-git-flow",
    "tags": [
      "rule",
      "git"
    ],
    "created_at": "2026-05-26T16:37:11.454Z",
    "updated_at": "2026-05-26T16:37:11.454Z",
    "expires_at": null,
    "access_count": 0,
    "last_accessed_at": "2026-05-26T16:37:11.454Z"
  },
  {
    "entry_id": "semantic-architecture_COMP-catalogs-1779813431455",
    "task_id": null,
    "step_number": null,
    "timestamp": "2026-05-26T16:37:11.454Z",
    "track_type": "semantic",
    "content": {
      "fact": "Rules + Architecture Catalogs [infrastructure]\nResponsibilities:\n- Store and manage project rules\n- Store and manage architecture components\n- Provide list/add operations",
      "category": "architecture",
      "confidence": 1,
      "domain": "infrastructure"
    },
    "relevance_score": 1,
    "source_ref": "architecture:COMP-catalogs",
    "tags": [
      "architecture",
      "infrastructure"
    ],
    "created_at": "2026-05-26T16:37:11.454Z",
    "updated_at": "2026-05-26T16:37:11.454Z",
    "expires_at": null,
    "access_count": 0,
    "last_accessed_at": "2026-05-26T16:37:11.454Z"
  },
  {
    "entry_id": "semantic-architecture_COMP-migrator-1779813431455",
    "task_id": null,
    "step_number": null,
    "timestamp": "2026-05-26T16:37:11.454Z",
    "track_type": "semantic",
    "content": {
      "fact": "Migration Subagent [application]\nResponsibilities:\n- Detect foreign task/knowledge systems\n- Analyze migration feasibility\n- Produce migration-analysis.json",
      "category": "architecture",
      "confidence": 1,
      "domain": "application"
    },
    "relevance_score": 1,
    "source_ref": "architecture:COMP-migrator",
    "tags": [
      "architecture",
      "application"
    ],
    "created_at": "2026-05-26T16:37:11.454Z",
    "updated_at": "2026-05-26T16:37:11.454Z",
    "expires_at": null,
    "access_count": 0,
    "last_accessed_at": "2026-05-26T16:37:11.454Z"
  },
  {
    "entry_id": "semantic-architecture_COMP-mode-switcher-1779813431455",
    "task_id": null,
    "step_number": null,
    "timestamp": "2026-05-26T16:37:11.454Z",
    "track_type": "semantic",
    "content": {
      "fact": "Mode Switcher [presentation]\nResponsibilities:\n- Switch between idle/plan/agent modes\n- Provide keyboard shortcut alt+m\n- Persist and restore mode across sessions",
      "category": "architecture",
      "confidence": 1,
      "domain": "presentation"
    },
    "relevance_score": 1,
    "source_ref": "architecture:COMP-mode-switcher",
    "tags": [
      "architecture",
      "presentation"
    ],
    "created_at": "2026-05-26T16:37:11.454Z",
    "updated_at": "2026-05-26T16:37:11.454Z",
    "expires_at": null,
    "access_count": 0,
    "last_accessed_at": "2026-05-26T16:37:11.454Z"
  },
  {
    "entry_id": "semantic-architecture_COMP-onboarding-1779813431455",
    "task_id": null,
    "step_number": null,
    "timestamp": "2026-05-26T16:37:11.454Z",
    "track_type": "semantic",
    "content": {
      "fact": "Onboarding Pipeline [application]\nResponsibilities:\n- Pre-check project state\n- Classify as clean/partial/foreign/mixed/compatible\n- Initialize knowledge structure\n- Generate AGENTS.md\n- Run onboarding wizard",
      "category": "architecture",
      "confidence": 1,
      "domain": "application"
    },
    "relevance_score": 1,
    "source_ref": "architecture:COMP-onboarding",
    "tags": [
      "architecture",
      "application"
    ],
    "created_at": "2026-05-26T16:37:11.454Z",
    "updated_at": "2026-05-26T16:37:11.454Z",
    "expires_at": null,
    "access_count": 0,
    "last_accessed_at": "2026-05-26T16:37:11.454Z"
  },
  {
    "entry_id": "semantic-architecture_COMP-researcher-1779813431455",
    "task_id": null,
    "step_number": null,
    "timestamp": "2026-05-26T16:37:11.454Z",
    "track_type": "semantic",
    "content": {
      "fact": "Research Subagent [application]\nResponsibilities:\n- Analyze project documentation, CI/CD, conventions\n- Produce context-research.json",
      "category": "architecture",
      "confidence": 1,
      "domain": "application"
    },
    "relevance_score": 1,
    "source_ref": "architecture:COMP-researcher",
    "tags": [
      "architecture",
      "application"
    ],
    "created_at": "2026-05-26T16:37:11.454Z",
    "updated_at": "2026-05-26T16:37:11.454Z",
    "expires_at": null,
    "access_count": 0,
    "last_accessed_at": "2026-05-26T16:37:11.454Z"
  },
  {
    "entry_id": "semantic-architecture_COMP-scout-1779813431455",
    "task_id": null,
    "step_number": null,
    "timestamp": "2026-05-26T16:37:11.454Z",
    "track_type": "semantic",
    "content": {
      "fact": "Scout Subagent [application]\nResponsibilities:\n- Analyze codebase by file extensions and config files\n- Produce stack.json with technology stack and module map",
      "category": "architecture",
      "confidence": 1,
      "domain": "application"
    },
    "relevance_score": 1,
    "source_ref": "architecture:COMP-scout",
    "tags": [
      "architecture",
      "application"
    ],
    "created_at": "2026-05-26T16:37:11.454Z",
    "updated_at": "2026-05-26T16:37:11.454Z",
    "expires_at": null,
    "access_count": 0,
    "last_accessed_at": "2026-05-26T16:37:11.454Z"
  },
  {
    "entry_id": "semantic-invariant_TASK-2026-0001-bootstrap_INV-1-1779813431455",
    "task_id": null,
    "step_number": null,
    "timestamp": "2026-05-26T16:37:11.454Z",
    "track_type": "semantic",
    "content": {